<?xml version="1.0" encoding="UTF-8"?>
<mapping 
    application="RplObjectBindingTest" 
    xmlns="http://www.rubicon-it.com/Data/DomainObjects/Mapping/1.0" 
    xmlns:xsi="http://www.w3.org/2001/XMLSchema-instance" 
    xsi:schemaLocation="http://www.rubicon-it.com/Data/DomainObjects/Mapping/1.0 ..\DomainObjects\Schemas\Mapping.xsd">
	<classes>
		<class id="ClassWithAllDataTypes">
			<type>Rubicon.Data.DomainObjects.Web.Test.Domain.ClassWithAllDataTypes, Rubicon.Data.DomainObjects.Web.Test</type>
			<entity name="TableWithAllDataTypes" />
			<storageProviderID>RpaTest</storageProviderID>
			<properties>
				<property name="BooleanProperty">
					<type>boolean</type>
					<column>Boolean</column>
				</property>
				<property name="ByteProperty">
					<type>byte</type>
					<column>Byte</column>
				</property>
				<property name="DateProperty">
					<type>date</type>
					<column>Date</column>
				</property>
				<property name="DateTimeProperty">
					<type>dateTime</type>
					<column>DateTime</column>
				</property>
				<property name="DecimalProperty">
					<type>decimal</type>
					<column>Decimal</column>
				</property>
				<property name="DoubleProperty">
					<type>double</type>
					<column>Double</column>
				</property>
				<property name="EnumProperty">
					<type>Rubicon.Data.DomainObjects.Web.Test.Domain.ClassWithAllDataTypes+EnumType, Rubicon.Data.DomainObjects.Web.Test</type>
					<column>Enum</column>
				</property>
				<property name="GuidProperty">
					<type>guid</type>
					<column>Guid</column>
				</property>
				<property name="Int16Property">
					<type>int16</type>
					<column>Int16</column>
				</property>
				<property name="Int32Property">
					<type>int32</type>
					<column>Int32</column>
				</property>
				<property name="Int64Property">
					<type>int64</type>
					<column>Int64</column>
				</property>
				<property name="SingleProperty">
					<type>single</type>
					<column>Single</column>
				</property>
				<property name="StringProperty">
					<type>string</type>
					<column>String</column>
					<maxLength>100</maxLength>
				</property>
				<property name="DelimitedStringArrayProperty">
					<type>string</type>
					<column>DelimitedStringArray</column>
					<maxLength>1000</maxLength>
				</property>
				<property name="BinaryProperty">
					<type>binary</type>
					<column>Binary</column>
				</property>
				<property name="NaBooleanProperty">
					<type>boolean</type>
					<column>NaBoolean</column>
					<nullable>true</nullable>
				</property>
        <property name="NaByteProperty">
          <type>byte</type>
          <column>NaByte</column>
          <nullable>true</nullable>
        </property>
				<property name="NaDateProperty">
					<type>date</type>
					<column>NaDate</column>
					<nullable>true</nullable>
				</property>
				<property name="NaDateTimeProperty">
					<type>dateTime</type>
					<column>NaDateTime</column>
					<nullable>true</nullable>
				</property>
        <property name="NaDecimalProperty">
          <type>decimal</type>
          <column>NaDecimal</column>
          <nullable>true</nullable>
        </property>
				<property name="NaDoubleProperty">
					<type>double</type>
					<column>NaDouble</column>
					<nullable>true</nullable>
				</property>
        <property name="NaGuidProperty">
          <type>guid</type>
          <column>NaGuid</column>
          <nullable>true</nullable>
        </property>
        <property name="NaInt16Property">
          <type>int16</type>
          <column>NaInt16</column>
          <nullable>true</nullable>
        </property>
				<property name="NaInt32Property">
					<type>int32</type>
					<column>NaInt32</column>
					<nullable>true</nullable>
				</property>
        <property name="NaInt64Property">
          <type>int64</type>
          <column>NaInt64</column>
          <nullable>true</nullable>
        </property>
        <property name="NaSingleProperty">
          <type>single</type>
          <column>NaSingle</column>
          <nullable>true</nullable>
        </property>
				<property name="StringWithNullValueProperty">
					<type>string</type>
					<column>StringWithNullValue</column>
					<nullable>true</nullable>
					<maxLength>100</maxLength>
				</property>
				<property name="DelimitedNullStringArrayProperty">
					<type>string</type>
					<column>DelimitedNullStringArray</column>
					<nullable>true</nullable>
					<maxLength>1000</maxLength>
				</property>
				<property name="NaBooleanWithNullValueProperty">
					<type>boolean</type>
					<column>NaBooleanWithNullValue</column>
					<nullable>true</nullable>
				</property>
        <property name="NaByteWithNullValueProperty">
          <type>byte</type>
          <column>NaByteWithNullValue</column>
          <nullable>true</nullable>
        </property>
				<property name="NaDateWithNullValueProperty">
					<type>date</type>
					<column>NaDateWithNullValue</column>
					<nullable>true</nullable>
				</property>
				<property name="NaDateTimeWithNullValueProperty">
					<type>dateTime</type>
					<column>NaDateTimeWithNullValue</column>
					<nullable>true</nullable>
				</property>
        <property name="NaDecimalWithNullValueProperty">
          <type>decimal</type>
          <column>NaDecimalWithNullValue</column>
          <nullable>true</nullable>
        </property>
				<property name="NaDoubleWithNullValueProperty">
					<type>double</type>
					<column>NaDoubleWithNullValue</column>
					<nullable>true</nullable>
				</property>
        <property name="NaGuidWithNullValueProperty">
          <type>guid</type>
          <column>NaGuidWithNullValue</column>
          <nullable>true</nullable>
        </property>
        <property name="NaInt16WithNullValueProperty">
          <type>int16</type>
          <column>NaInt16WithNullValue</column>
          <nullable>true</nullable>
        </property>
				<property name="NaInt32WithNullValueProperty">
					<type>int32</type>
					<column>NaInt32WithNullValue</column>
					<nullable>true</nullable>
				</property>
        <property name="NaInt64WithNullValueProperty">
          <type>int64</type>
          <column>NaInt64WithNullValue</column>
          <nullable>true</nullable>
        </property>
        <property name="NaSingleWithNullValueProperty">
          <type>single</type>
          <column>NaSingleWithNullValue</column>
          <nullable>true</nullable>
        </property>        
				<property name="NullableBinaryProperty">
					<type>binary</type>
					<column>NullableBinary</column>
					<nullable>true</nullable>
					<maxLength>1000000</maxLength>
				</property>
				<relationProperty name="ClassForRelationTestMandatory" relationID="ClassWithAllDataTypesToClassForRelationTestMandatory" cardinality="one" isMandatory="true">
					<column>TableForRelationTestMandatory</column>
				</relationProperty>
				<relationProperty name="ClassForRelationTestOptional" relationID="ClassWithAllDataTypesToClassForRelationTestOptional" cardinality="one" isMandatory="false">
					<column>TableForRelationTestOptional</column>
				</relationProperty>
				<relationProperty name="ClassesForRelationTestMandatoryNavigateOnly" relationID="ClassForRelationTestToClassWithAllDataTypesMandatory" cardinality="many" isMandatory="true" />
				<relationProperty name="ClassesForRelationTestOptionalNavigateOnly" relationID="ClassForRelationTestToClassWithAllDataTypesOptional" cardinality="many" isMandatory="false" />
			</properties>
		</class>
				
		<class id="ClassForRelationTest">
			<type>Rubicon.Data.DomainObjects.Web.Test.Domain.ClassForRelationTest, Rubicon.Data.DomainObjects.Web.Test</type>
			<entity name="TableForRelationTest" />
			<storageProviderID>RpaTest</storageProviderID>
			<properties>
				<property name="Name">
					<type>string</type>
					<column>Name</column>
					<maxLength>100</maxLength>
				</property>
				<relationProperty name="ClassWithAllDataTypesMandatoryNavigateOnly" relationID="ClassWithAllDataTypesToClassForRelationTestMandatory" cardinality="one" isMandatory="true" />
				<relationProperty name="ClassWithAllDataTypesOptionalNavigateOnly" relationID="ClassWithAllDataTypesToClassForRelationTestOptional" cardinality="one" isMandatory="false" />
				<relationProperty name="ClassWithAllDataTypesMandatory" relationID="ClassForRelationTestToClassWithAllDataTypesMandatory" cardinality="one" isMandatory="true">
					<column>TableWithAllDataTypesMandatory</column>
				</relationProperty>
				<relationProperty name="ClassWithAllDataTypesOptional" relationID="ClassForRelationTestToClassWithAllDataTypesOptional" cardinality="one" isMandatory="false">
					<column>TableWithAllDataTypesOptional</column>
				</relationProperty>			
			</properties>
		</class>

    <class id="ClassWithoutProperties">
      <type>Rubicon.Data.DomainObjects.Web.Test.Domain.ClassWithoutProperties, Rubicon.Data.DomainObjects.Web.Test</type>    
      <entity name="TableWithoutColumns"></entity>
      <storageProviderID>RpaTest</storageProviderID>
      <properties />
    </class>
    
    <class id="ClassWithUndefinedEnum">
      <type>Rubicon.Data.DomainObjects.Web.Test.Domain.ClassWithUndefinedEnum, Rubicon.Data.DomainObjects.Web.Test</type>    
      <entity name="TableWithUndefinedEnum"></entity>
      <storageProviderID>RpaTest</storageProviderID>
      <properties>
        <property name="UndefinedEnum">
          <type>Rubicon.Data.DomainObjects.Web.Test.Domain.UndefinedEnum, Rubicon.Data.DomainObjects.Web.Test</type>
          <column>UndefinedEnum</column>
        </property>
      </properties>
    </class>
 
 	</classes>
</mapping>