<?xml version="1.0" encoding="UTF-8"?>
<mapping 
    application="UnitTests" 
    xmlns="http://www.re-motion.org/Data/DomainObjects/Mapping/1.0" 
    xmlns:xsi="http://www.w3.org/2001/XMLSchema-instance" 
    xsi:schemaLocation="http://www.re-motion.org/Data/DomainObjects/Mapping/1.0 ..\..\..\..\DomainObjects\Schemas\Mapping.xsd">
  <classes>
		<class id="Customer">
			<type>Remotion.Data.DomainObjects.Legacy.UnitTests.TestDomain.Customer, Remotion.Data.DomainObjects.Legacy.UnitTests</type>
			<entity name="Company" />
			<storageProviderID>TestDomain</storageProviderID>
			<properties>
			  <relationProperty name="Orders" relationID="CustomerToOrder" isMandatory="false" cardinality="many">
			  	<column>InvalidColumn</column>	
			    <oppositeClass>Order</oppositeClass>
			  </relationProperty>			  
			</properties>
		</class>
		<class id="Order">
			<type>Remotion.Data.DomainObjects.Legacy.UnitTests.TestDomain.Order, Remotion.Data.DomainObjects.Legacy.UnitTests</type>
			<entity name="Order"/>
			<storageProviderID>TestDomain</storageProviderID>
			<properties />
		</class>		
  </classes>
</mapping>  