<?xml version="1.0" encoding="UTF-8"?>
<mapping 
    application="UnitTests" 
    xmlns="http://www.rubicon-it.com/Data/DomainObjects/Mapping/1.0" 
    xmlns:xsi="http://www.w3.org/2001/XMLSchema-instance" 
    xsi:schemaLocation="http://www.rubicon-it.com/Data/DomainObjects/Mapping/1.0 ..\..\..\..\DomainObjects\Schemas\Mapping.xsd">
	<classes>
		<class id="Order">
			<type>Remotion.Data.DomainObjects.Legacy.UnitTests.TestDomain.Order, Remotion.Data.DomainObjects.Legacy.UnitTests</type>
			<entity name="Order" />
			<storageProviderID>TestDomain</storageProviderID>
			<properties>
				<property name="OrderNumber">
					<type>int32</type>
					<column>OrderNo</column>
				</property>
				<property name="DeliveryDate">
					<type>dateTime</type>
					<column>DeliveryDate</column>
				</property>
				<relationProperty name="OrderTicket" relationID="OrderToOrderTicket" cardinality="one" isMandatory="true" />
			</properties>
		</class>
		<class id="OrderTicket">
			<type>Remotion.Data.DomainObjects.Legacy.UnitTests.TestDomain.OrderTicket, Remotion.Data.DomainObjects.Legacy.UnitTests</type>
			<entity name="OrderTicket" />
			<storageProviderID>TestDomain</storageProviderID>
			<properties>
				<property name="FileName">
					<type>string</type>
					<column>FileName</column>
					<maxLength>255</maxLength>
				</property>
				<relationProperty name="Order" relationID="OrderToOrderTicket" cardinality="many" isMandatory="true">
					<column>OrderID</column>
				</relationProperty>
			</properties>
		</class>
	</classes>
</mapping>