<?xml version="1.0" encoding="UTF-8"?>
<mapping 
    application="UnitTests" 
    xmlns="http://www.rubicon-it.com/Data/DomainObjects/Mapping/1.0" 
    xmlns:xsi="http://www.w3.org/2001/XMLSchema-instance" 
    xsi:schemaLocation="http://www.rubicon-it.com/Data/DomainObjects/Mapping/1.0 ..\..\..\..\DomainObjects\Schemas\Mapping.xsd">
  <classes>
		<class id="Company">
			<type>Rubicon.Data.DomainObjects.Legacy.UnitTests.TestDomain.Company, Rubicon.Data.DomainObjects.Legacy.UnitTests</type>
			<entity name="Company" />
			<storageProviderID>TestDomain</storageProviderID>
			<properties />
		</class>
		<class id="Customer" baseClass="NonExistingClass">
			<type>Rubicon.Data.DomainObjects.Legacy.UnitTests.TestDomain.Customer, Rubicon.Data.DomainObjects.Legacy.UnitTests</type>
			<entity name="Company" />
			<storageProviderID>TestDomain</storageProviderID>
			<properties />
		</class>
  </classes>
</mapping>  