<?xml version="1.0" encoding="UTF-8"?>
<mapping 
    application="UnitTests" 
    xmlns="http://www.rubicon-it.com/Data/DomainObjects/Mapping/1.0" 
    xmlns:xsi="http://www.w3.org/2001/XMLSchema-instance" 
    xsi:schemaLocation="http://www.rubicon-it.com/Data/DomainObjects/Mapping/1.0 ..\..\..\..\DomainObjects\Schemas\Mapping.xsd">
  <classes>
    <class id="Customer">
      <properties>
        <!-- Note: CustomerSince has no sub element column. -->
        <property name="CustomerSince">
          <type>dateTime</type>
          <nullable>true</nullable>
        </property>
        <property name="Type">
          <type>Rubicon.Data.DomainObjects.UnitTests.TestDomain.Customer+CustomerType, Rubicon.Data.DomainObjects.UnitTests</type>
          <column>CustomerType</column>
        </property>
      </properties>
      <storageProviderID>TestDomain</storageProviderID>
      <entity name="Company"/>
      <type>Rubicon.Data.DomainObjects.UnitTests.TestDomain.Customer, Rubicon.Data.DomainObjects.UnitTests</type>
    </class>
  </classes>
</mapping>
