<?xml version="1.0" encoding="UTF-8"?>
<mapping 
    application="UnitTests" 
    xmlns="http://www.rubicon-it.com/Data/DomainObjects/Mapping/1.0" 
    xmlns:xsi="http://www.w3.org/2001/XMLSchema-instance" 
    xsi:schemaLocation="http://www.rubicon-it.com/Data/DomainObjects/Mapping/1.0 ..\..\..\..\DomainObjects\mapping.xsd">
  <classes>
		<class id="Customer">
			<type>Rubicon.Data.DomainObjects.UnitTests.TestDomain.Customer, Rubicon.Data.DomainObjects.UnitTests</type>
			<entity name="Company" />
			<storageProviderID>TestDomain</storageProviderID>
			<properties>
				<property name="CustomerSince">
					<type>dateTime</type>
					<column>CustomerSince</column>
					<nullable>true</nullable>					
				</property>
				<property name="Type">
					<type>Rubicon.Data.DomainObjects.UnitTests.TestDomain.Customer+CustomerType, Rubicon.Data.DomainObjects.UnitTests</type>
					<!-- The column does not comply with mapping, because property 'CustomerSince' already refers to it. -->
					<column>CustomerSince</column>
				</property>
			</properties>
		</class>
  </classes>
</mapping>  