<?xml version="1.0" encoding="UTF-8"?>
<mapping 
    application="UnitTests" 
    xmlns="http://www.rubicon-it.com/Data/DomainObjects/Mapping/1.0" 
    xmlns:xsi="http://www.w3.org/2001/XMLSchema-instance" 
    xsi:schemaLocation="http://www.rubicon-it.com/Data/DomainObjects/Mapping/1.0 ..\..\..\..\DomainObjects\Schemas\Mapping.xsd">
    
  <classes>
		<class id="Company">
			<type>Remotion.Data.DomainObjects.Legacy.UnitTests.TestDomain.Company, Remotion.Data.DomainObjects.Legacy.UnitTests</type>
			<entity name="Company" />
			<storageProviderID>TestDomain</storageProviderID>
			<properties>
				<property name="Name">
					<type>string</type>
					<column>Name</column>
					<maxLength>100</maxLength>
				</property>
			</properties>
		</class>
		<class id="Customer" baseClass="Company">
			<type>Remotion.Data.DomainObjects.Legacy.UnitTests.TestDomain.Customer, Remotion.Data.DomainObjects.Legacy.UnitTests</type>
			<entity name="Company" />
			<storageProviderID>OtherStorageProvider</storageProviderID>
			<properties>
				<property name="CustomerSince">
					<type>dateTime</type>
					<column>CustomerSince</column>
					<nullable>true</nullable>					
				</property>
				<property name="Type">
					<type>Remotion.Data.DomainObjects.Legacy.UnitTests.TestDomain.Customer+CustomerType, Remotion.Data.DomainObjects.Legacy.UnitTests</type>
					<column>CustomerType</column>
				</property>
			</properties>
		</class>
  </classes>
</mapping>  