<?xml version="1.0" encoding="UTF-8"?>
<mapping application="UnitTests" xmlns="http://www.rubicon-it.com/Data/DomainObjects/Mapping/1.0" xmlns:xsi="http://www.w3.org/2001/XMLSchema-instance" xsi:schemaLocation="http://www.rubicon-it.com/Data/DomainObjects/Mapping/1.0 ..\DomainObjects\mapping.xsd">
	<classes>
		<class id="ClassWithUnresolvedTypes">
			<type>UnknownClassType, Rubicon.Data.DomainObjects.UnitTests</type>
			<entity name="TableWithUnresolvedTypes"/>
			<storageProviderID>TestDomain</storageProviderID>
			<properties>
				<property name="Int32Property">
					<type>int32</type>
					<column>Int32Column</column>
				</property>
				<property name="EnumProperty">
					<type>UnknownClassType+EnumType, Rubicon.Data.DomainObjects.UnitTests</type>
					<column>EnumColumn</column>
				</property>
			</properties>
		</class>
	</classes>
</mapping>
