<?xml version="1.0" encoding="UTF-8"?>
<mapping 
    application="UnitTests" 
    xmlns="http://www.rubicon-it.com/Data/DomainObjects/Mapping/1.0" 
    xmlns:xsi="http://www.w3.org/2001/XMLSchema-instance" 
    xsi:schemaLocation="http://www.rubicon-it.com/Data/DomainObjects/Mapping/1.0 ..\mapping.xsd">
	<classes>
		<class id="Order">
			<type>Rubicon.Data.DomainObjects.UnitTests.TestDomain.Order, Rubicon.Data.DomainObjects.UnitTests</type>
			<entity>Order</entity>
			<storageProviderID>TestDomain</storageProviderID>
			<properties>
				<property name="OrderNumber">
					<type>int32</type>
					<column>OrderNo</column>
				</property>
				<property name="DeliveryDate">
					<type>dateTime</type>
					<column>DeliveryDate</column>
				</property>
				<property name="Customer">
					<type>objectID</type>
					<column>CustomerID</column>
				</property>
				<property name="Official">
					<type>objectID</type>
					<column>OfficialID</column>
				</property>				
			</properties>
		</class>
		<class id="OrderTicket">
			<type>Rubicon.Data.DomainObjects.UnitTests.TestDomain.OrderTicket, Rubicon.Data.DomainObjects.UnitTests</type>
			<entity>OrderTicket</entity>
			<storageProviderID>TestDomain</storageProviderID>
			<properties>
				<property name="FileName">
					<type>string</type>
					<column>FileName</column>
					<maxLength>255</maxLength>
				</property>
				<property name="Order">
					<type>objectID</type>
					<column>OrderID</column>
				</property>
			</properties>
		</class>
	</classes>

	
	<relations>
		<relation id="OrderToOrderTicket">
			<virtualEndPoint cardinality="one" isMandatory="true">
				<class id="Order" />
				<property name="OrderTicket">
					<!-- Line below is invalid for virtualEndPoint with cardinality="one" -->
					<collectionType>Rubicon.Data.DomainObjects.DomainObjectCollection, Rubicon.Data.DomainObjects</collectionType>
				</property>	
			</virtualEndPoint>
			<endPoint isMandatory="true">
				<class id="OrderTicket" />
				<property name="Order" />
			</endPoint>
		</relation>
	</relations>
</mapping>