<?xml version="1.0" encoding="UTF-8"?>
<mapping application="UnitTests" xmlns="http://www.re-motion.org/Data/DomainObjects/Mapping/1.0" xmlns:xsi="http://www.w3.org/2001/XMLSchema-instance" xsi:schemaLocation="http://www.re-motion.org/Data/DomainObjects/Mapping/1.0 ..\..\..\..\DomainObjects\Schemas\Mapping.xsd">
	<classes>
		<class id="Customer">
		  <!-- Note: Type contains leading and trailing whitespace -->
			<type>
			  Remotion.Data.DomainObjects.Legacy.UnitTests.TestDomain.Customer, Remotion.Data.DomainObjects.Legacy.UnitTests
			</type>
			<entity name="Company"/>
			<storageProviderID>TestDomain</storageProviderID>
			<properties>
				<property name="CustomerSince">
					<type>dateTime</type>
					<column>CustomerSince</column>
					<nullable>true</nullable>
				</property>
				<property name="Type">
				  <!-- Note: Type contains leading and trailing whitespace -->
					<type>
					  Remotion.Data.DomainObjects.Legacy.UnitTests.TestDomain.Customer+CustomerType, Remotion.Data.DomainObjects.Legacy.UnitTests
					</type>
					<column>CustomerType</column>
				</property>
				<relationProperty name="Orders" relationID="CustomerToOrder" cardinality="many" isMandatory="false">
				  <!-- Note: Type contains leading and trailing whitespace -->
					<collectionType>
						Remotion.Data.DomainObjects.Legacy.UnitTests.TestDomain.OrderCollection, Remotion.Data.DomainObjects.Legacy.UnitTests
					</collectionType>
					<sortExpression>OrderNo asc</sortExpression>
				</relationProperty>
			</properties>
		</class>
		<class id="Order">
			<type>Remotion.Data.DomainObjects.Legacy.UnitTests.TestDomain.Order, Remotion.Data.DomainObjects.Legacy.UnitTests</type>
			<entity name="Order"/>
			<storageProviderID>TestDomain</storageProviderID>
			<properties>
				<property name="OrderNumber">
					<type>int32</type>
					<column>OrderNo</column>
				</property>
				<property name="DeliveryDate">
					<type>dateTime</type>
					<column>DeliveryDate</column>
				</property>
				<relationProperty name="Customer" relationID="CustomerToOrder" cardinality="one" isMandatory="true">
					<column>CustomerID</column>
				</relationProperty>				
				<relationProperty name="OrderTicket" relationID="OrderToOrderTicket" cardinality="one" isMandatory="true"/>
				<relationProperty name="OrderItems" relationID="OrderToOrderItem" cardinality="many" isMandatory="true"/>
			</properties>
		</class>
		<class id="OrderItem">
			<type>Remotion.Data.DomainObjects.Legacy.UnitTests.TestDomain.OrderItem, Remotion.Data.DomainObjects.Legacy.UnitTests</type>
			<entity name="OrderItem"/>
			<storageProviderID>TestDomain</storageProviderID>
			<properties>
				<property name="Position">
					<type>int32</type>
					<column>Position</column>
				</property>
				<property name="Product">
					<type>string</type>
					<column>Product</column>
					<maxLength>100</maxLength>
				</property>
				<relationProperty name="Order" relationID="OrderToOrderItem" cardinality="one" isMandatory="true">
					<column>OrderID</column>
				</relationProperty>
			</properties>
		</class>
		<class id="OrderTicket">
			<type>Remotion.Data.DomainObjects.Legacy.UnitTests.TestDomain.OrderTicket, Remotion.Data.DomainObjects.Legacy.UnitTests</type>
			<entity name="OrderTicket"/>
			<storageProviderID>TestDomain</storageProviderID>
			<properties>
				<property name="FileName">
					<type>string</type>
					<column>FileName</column>
					<maxLength>255</maxLength>
				</property>
				<relationProperty name="Order" relationID="OrderToOrderTicket" cardinality="one" isMandatory="true">
					<column>OrderID</column>
				</relationProperty>
			</properties>
		</class>
	</classes>
</mapping>
